,URL,Title,Content,Positive_Score,Negative_Score,Polarity_Score,Subjectivity_Score,Average_Sentence_Length,Percentage_of_Complex_Words,Fog_Index,Average_Number_Of_Words_per_Sentence,Complex_Words,Word_Count,Syllable_Count_,Personal_Pronouns,Average_Word_Length
1,https://insights.blackcoffer.com/ai-in-healthcare-to-improve-patient-outcomes/,AI in healthcare to Improve Patient Outcomes,introduction“if anything kills 10 million people next decades highly infectious virus rather war missiles microbes” bill gates’s remarks ted conference 2014 right world avoided ebola outbreak new unprecedented invisible virus hit us met overwhelmed unprepared healthcare system oblivious population public health emergency demonstrated lack scientific consideration underlined alarming need robust innovations health medical facilities past years artificial intelligence proven tangible potential healthcare sectors clinical practices translational medical biomedical researchafter first case detected china december 31st 2019 ai program developed bluedot alerted world pandemic quick realise ai’s ability analyse large chunks data could help detecting patterns identifying tracking possible carriers virusmany tracing apps use ai keep tabs people infected prevent risk crossinfection using ai algorithms track patterns extract features classify categorise themso ai thatibm watson sophisticated ai works cloud computing natural language processing prominently contributed healthcare sector global level conversational ai since 2013 watson helped recommending treatments patients suffering cancer ensure get best treatment optimum costsresearchers google inc showed ai system trained thousands images achieve physicianlevel sensitivityby identifying molecular patterns associated disease status subtypes gene expression protein abundance levels machine learning methods detect fatal diseases like cancer early stage machine learning ml techniques focus mainly analyzing structured data help clustering patients’ traits infer probability disease outcomes since patient traits mainly include masses data relating age gender disease history diseasespecific data like diagnostic imaging gene expressions etc ml extract features data inputs constructing data analytical algorithmsml algorithms either supervised unsupervised unsupervised learning helps extracting features clustering similar features together leads early detection diseases clustering principal component analysis enable grouping clustering similar traits together used maximize minimize similarity patients within clusters since patient traits recorded multiple dimensions genes principal component analysispca creates apparatus reduce dimensions humans could done alonesupervised learning considers outcomes subjects together traits correlates inputs outputs predict probability getting particular clinical event expected value disease level expected survival time risk down’s syndromebiomarker panels mostly used detect ovarian cancer outperformed conventional statistical methods due machine learning addition this use ehrs bayesian networks part supervised machine learning algorithms predict clinical outcomes mortality respectivelyunstructured data clinical notes texts converted machinereadable structured data help natural language processingnlp nlp works two components text processing classification text processing helps identifying series diseaserelevant keywords clinical notes classification categorized normal abnormal cases chest screening ml nlp helped find abnormalities lungs provide treatment covid patients healthcare organizations use nlpbased chatbots increase interactions patients keeping mental health wellness checkdeep learning modern extension classical neural network techniques helps explore complex nonlinear patterns data using algorithms like convolution neural network recurrent neural network deep belief network deep neural network enables accurate clinical prediction comes genome interpretation deep neural networks surpass conventional methods logistics regression support vector machinessepsis watch ai system trained deep learning algorithms holds capability analyze 32 million data points create patient’s risk score identify early stages sepsisanother method known learningbased optimization sampling pattern loupe based integrating full resolution mri scans convolutional neural network algorithm helps creating accurate reconstructionsrobotic surgery widely considered delicate surgeries like gynaecology prostate surgery even striking right balance human decisions ai precision robotic surgery reduces surgeon efficiency manually operated console thus autonomous robotic surgery rise inventions robotic silicon fingers mimic sense touch surgeons need identify organs cut tissues etc robotic catheters navigate whether touching blood tissue valveresearchers children’s national hospital washington already developed ai called smart tissue autonomous robot star performs colon anastomosis help mlpowered suturing tool automatically detects patient’s breathing pattern apply suture correct pointan image star surgerycloud computing healthcare helped retrieving sharing medical records safely reduction maintenance costs technology doctors various healthcare workers access detailed patient data helps speeding analysis ultimately leading better care form accurate information medications therapieshow help biomedical researchsince ai analyze literature beyond readability used concise biomedical research help ml algorithms nlp ai accelerate screening indexing biomedical research ranking literature interest allows researchers formulate test scientific hypotheses far precisely quickly taking next level ai systems like computational modelling assistant cma helps researchers construct simulation models concepts mind innovations majorly contributed topics tumour suppressor mechanisms proteinprotein interaction information extractionai precision medicinesince precision medicine focuses healthcare interventions individuals groups patients based profile various ai devices pave way practice efficiently help ml complex algorithms like large datasets used predict create optimal treatment strategydeep learning neural networks used process data healthcare apps keep close watch patient’s emotional state food intake health monitoring “omics” refers collective technologies help exploring roles relationships various branches ending suffix “omics” genomics proteomics etc omicsbased tests based machine learning algorithms help find correlations predict treatment responses ultimately creating personalized treatments individual patients helps psychology neuro patientsfor psychologists studying creativity ai promising new classes experiments developing data structures programs exploring novel theories new horizon studies show ai conduct therapy sessions etherapy sessions assessments autonomously also assisting human practitioners before during sessions detection computational analysis psychological signal project uses ml computer vision nlp analyze language physical gestures social signals identify cues human distress groundbreaking technology assesses soldiers returning combat recognizes require mental health support future combine data captured facetoface interviews information sleeping eating online behaviours complete patient viewstroke identificationstroke another frequently occurring disease affects 500 million people worldwide thrombus vessel cerebral infarction major about 85 cause stroke occurrence recent years ai techniques used numerous strokerelated studies early detection timely treatment along efficient outcome prediction help solve problem ai disposal large amounts data rich information complications reallife clinical questions addressed arena currently two ml algorithms genetic fuzzy finite state machine pca implemented build model building solution include human activity recognition stage stroke onset detection stage alert stroke message activated soon movement significantly different normal pattern recorded ml methods applied neuroimaging data assist disease evaluation predicting stroke treatment diagnosispatient monitoringtoday market aibased patient monitoring impressive monetarily enticing evolving artificial sensors smart technologies explores everything braincomputer interfaces nanorobotics companies smartwatches engaged people perform remote monitoring even “patients” obvious place start wearable embedded sensors glucose monitors pulse monitors oximeters ecg monitors patient monitoring becoming crucial ai finds numerous applications chronic conditions intensive care units operating rooms emergency rooms cardiac wards timeless clinical decisionmaking measured seconds advances started gain traction like smart prosthetics implants play impeccable role patient management postsurgery rehabilitation demographics laboratory results vital signs also used predict cardiac arrest transfer intensive care unit even death addition interpretable machinelearning model assist anesthesiologists predicting hypoxaemia events surgery suggests deeplearning algorithms raw patientmonitoring data could better used avoid information overload alert overload enabling accurate clinical prediction timely decisionmaking conclusionconsidering vast range tasks ai do evident holds deep potential improving patient outcomes skyrocketing levels using sophisticated algorithms ai bring revolution healthcare sector even facing challenges like whether technology able deliver promises ethical measures training physicians use it standard regulations etc role ai transforming clinical practices cannot ignored biggest challenge integration ai daily practice overcome within period technologies mature making system far enhanced effectiveblackcoffer insights 29 sanskriti sunderum aayushi nauhwar srcc delhi university,70,26,0.45833332855902786,0.8421052557710066,14.487179487179487,0.04716689028795541,5.813738550986978,14.45,457,9463,3196,1,1.0
2,https://insights.blackcoffer.com/what-if-the-creation-is-taking-over-the-creator/,What if the Creation is Taking Over the Creator?,human minds fascination carrying potential tinkering nature pixie dust intelligence creating solving mysteries wonders anything admiration however matter captivating human mind be could sometimes appalled could hunger maybe desire want more go beyond unravel limitations maybe something like pure greed humans never stopped always keep evolving comes intelligence makes supremeintelligence calls supremacy so evolve something opposed challenge human minds capabilities making question importance among themselves artificial intelligence came revolution havoc first came light concept making machines work own like granting machines –the intelligencethe idea making machines work like humans came back 19s back people didn’t believe thing making nonliving thing work think carry tasks own mention actually surpass humans skills facts did 1997 greatest chess player garry kasparov defeated chess game machine exactly top skilled human lost mere machine created another could’ve never defeated him rule power betterment skills granted supremacy ai machines tools equipment something helped unskilled person mind intelligence creates something could skilled work perfection precision well initially was however time passed humans got drawn puzzle ai lot changed human research went deeper deeper result machines evolved itat present ai  machines growing field develops improves become part industrial revolution industries laborious work taken care humans replaced machines naturally evolution machines precision mass productivity quality control time efficiencies factors made better choice choice humansthis led fear fear notsodistant future future maybe machines evolved they’ll take need human employee leading unemployment population increase around world became new tech threat labor market again… true it ai really oppose threat adapting technology make millions people lose jobs lead mass unemployment machines really surpass humans will creation take creatorno matter fearful future ai may seem reality scary truth ai present reality key holds power unlock whole next level human evolution technology growing time technology idea today idea implemented it’s working carried out nobody could stop advancement growth artificial intelligence it’s wave already flowing present generation generations come learn learn swim flow avoid drowningmany jobs replaced machines ai evolves it’ll keep challenging human minds skills present covid 19 situation contactless cashiers robots delivering packages already taken usual routine tasks jobs secretaries schedulers bookkeeper risk too manufacturing units agriculture food services retail transportation  logistic hospitality part aiaffected automation estimation said around 20 million jobs especially including manufacturing lost robots ai robotics 3d printing genetics make way in even architects medical docs music composers feel threatened technology making us question ai even edge us brain jobs too terrifyinghowever much machines replacing jobs they’ll also creating new jobs economic growth innovation investment around 133 million jobs said generated newly enhanced jobs create benefits amplify one’s creativity strategy entrepreneurial skills catchwell it’s skills even though ai creating 3 times jobs destroying it’s skills count ai surged new job opportunities opportunities like senior data scientist mobile application developer seo specialist jobs never heard ai it’s born however jobs qualification one needs highlevel skills acquire skills expensive timeconsuming task future generation might able cope real struggle faced present two generations it’s vulnerability skill gap unemployment youths ones crushed mosttherefore advancement ai becomes inevitable remains choice adapt learn equip grow it companies work together build aiready workplace collaborate government educators nonprofit organizations work together bring policies could help understand technologies’ impacts faster also providing employees security economic business planning made considerable minimizing impact local jobs properly maximizing opportunitiesthe employees provided proper tools carry along new opportunities acquiring aibased skills daytoday work new skills identified implemented upskilling continual learning initiatives employees maximize robotic quotient learn core skills they’ll adapt new working models understand roles coming future howsoever it’s like ai totally take control even though ai proves better choice still limitations present first it’s expensive secondly manufacturing machines bulk good environment machines also high maintenance therefore human labor often come cheaper considered machines underdeveloped countries find hard equip people upskilling reskilling required ai workplace ai play role countries might take years ai also risky unethical it’s hard figure held responsible cases ai went wrongno matter advanced ai gets skills humans always upper hand ie soft skills skills like teamwork communication creativity critical thinking something ai hasn’t able beat us yet value creativity leadership emotional intelligence increased although machines coming humans causing lack humantohuman interaction humans seem fade away littlewith era comes need good leaders leaders capable handling machines humans together ones organized enough manage skilled unskilled employees providing unskilled trainees proper training leaders hold profound soft skills encourage teamwork working along machines ones patient calm optimized conclusion yes ai machines going challenging there’s nothing humans haven’t overcome adaptation upgradation going primary factor survival witness onset 4th industrial revolution let’s buckle seats race along highway essential fuels skills let eliminated all unending race infinity end could try run fuel try outdated blackcoffer insights 29 glady karunya institute technology sciences,56,28,0.3333333293650794,0.7368420987996307,10.098591549295774,0.11310208778563209,4.084677454832563,9.78048780487805,688,5874,5150,3,1.0
3,https://insights.blackcoffer.com/what-jobs-will-robots-take-from-humans-in-the-future/,What Jobs Will Robots Take From Humans in The Future?,introductionai rapidly evolving employment sector particularly matters involving business finance finance management economics accounting among popular university courses globally particularly graduate level due high employability however evolution machinery industries changing that according research 230000 jobs sectors may replaced ai agents next 5 years due nature work employees responsible tasks data analysis keeping track numerical information machines excel at large complicated data sets analyzed faster efficiently aipowered computers people algorithmic trading procedures produce automated deals less likely produced without minute errors undertaken humans matters involving industrial work subsection artificial intelligence used namely machine learningmachine learning term used application artificial intelligence ai systems involves assimilating processing information gaining experience mainly concerned development technology computer programs improvement process mainly divided seven steps start collection data data collected internal database perhaps iot structure second timeconsuming step cleaning preparing rearranging data involves recognition outliers trends missing information outcome accurate possible third step consists formatting data useful source information variety sources step four ai comes place selfservice data processing tools may useful provide intelligent services matching data attributes distinct databases intelligently integrating them data arranged better represent specific pattern lastly data divided two sets one training algorithm one analysisthere three types machine learning supervised unsupervised reinforcement learning common bunch supervised machine learning based accurately labeled data machine given collection information including outcome operation rest information referred ‘input features’ ‘supervises’ machine guiding establish connections variantsin case unsupervised learning machine isn’t given labeled sets data divided into allowing recognize create patterns within information provided since computers capabilities identifying distinguished similarities method helps classifying datareinforcement learning comprises experiencebased learning similar people learn due reward punishment system based actionsthese variations system learning recently integrated business finance elaborated following passagesmachine learning finance bankingthere many ways machine learning used finance banking common place used detect frauds fraud common problem financial service companies accounts billions dollars misfortune year common frauds credit debit card usage stranger document forgery mortgage fraudusually finance companies keep enormous amount data stored online increases risk information accessed without authorization expanding innovative headway misrepresentation monetary business currently viewed high danger significant information fraud recognition frameworks past planned dependent bunch rules could effortlessly bypassed current fraudsters therefore companies today leverage machine learning combat fraudulent financial transactions machine learning works looking enormous informational indexes distinguish unique suspicious activities additional examination security groups works looking exchange information focuses – like client’s record history ip address area forth depending type exchange taking place program automatically refuse withdrawal purchase person makes decisionexamples fraud detection software used banks include feedzai data visor teradatamachine learning also used algorithmic trading portfolio management loan underwriting chatbots improving customer servicealgorithmic trading interaction executing orders using computerized premodified exchanging guidelines represent factors like value timing volume algorithm set directions solving problem computer calculations send little parts full request market long runin contrast human dealers algorithmic exchanging investigate enormous volumes information every day therefore make thousands trades every day machine learning settles quick exchanging choices gives human traders benefit market normal likewise algorithmic exchanging doesn’t settle exchanging choices dependent feelings typical constraint among human dealers whose judgment might influenced feelings individual desires exchanging technique generally utilized multifaceted investment administrators monetary foundations automate trading activitiesin banking industry organizations access large number shopper information machine learning prepared work order simplify underwriting process machine learning calculations settle speedy choices endorsing credit scoring save organizations time monetary assets utilized peopledata scientists train algorithms analyze millions consumer data coordinate information records search interesting special cases settle choice whether shopper meets requirements advance protection instance calculation prepared proficient method examine shopper information like age pay occupation buyer’s credit conductthe benefits machine learningas form revolutionary technology usage machine learning debated beneficial properties weighed possible disadvantages it’s observed upon correct usage may used solve wide range business challenges anticipate complicated customer behavior we’ve also seen several largest conglomerates google amazon microsoft introduce cloud machine learning platformstechnology vs human intelligencein terms business ml aid businesses identifying consumer’s demands formulate pattern based them allowing companies reach consumers maximize sales eliminates need expenses maintenance reducing risks associated unexpected breakdowns minimizes wasteful costs firms historical data process visualization tool flexible analytical environment feedback loop may used build ml architecture input data another agitating chore businesses present machine learning step manual labor eradicates possibility errors caused manual labor causing disruptions provides employees extra time handle tasksin financial sector machine learning already utilized portfolio management algorithmic trading loan underwriting fraud detection chatbots conversational interfaces security customer support sentiment analysis among future uses ml banking another aspect business involving artificial intelligence includes image recognition entails system program recognizes objects people places movements photos identifies photographs using imaging system machine recognition tech artificial intelligence programmed algorithmsthe downfalls machine learningwith benefits advancement machine learning isn’t perfect thing several disadvantages information acquisition time resources high errors wrong interpretations one major hurdles amount finance needed invest machine learning successful project issues fact ai requires gigantic informational indexes train on ought unbiased good quality likewise times wait new information produced machine learning needs sufficient opportunity calculations learn adequately satisfy accuracy relevancy also needs huge resources work mean extra requirements computer work another significant problem capacity precisely decipher results produced calculations likewise cautiously pick algorithms get wanted resultsconclusionthere various reports past current years claim significant piece human labor force replaced via robots machines years come excessive innovative work led field computerized reasoning many dread significant job crisis unfurl since numerous positions precisely productively performed use machines countries like japan mainly computer programs ai used secondary tertiary sectors cleaning house depositing money banks everything done ai however ai cannot replace humans future humans several capabilities which even several technological advancements machine would able have capabilities include creative thinking creative problem solving human connection example child goes doctor get injection nurse always relaxes child afraid needle machine’s touch would able soothe child another example could humans tend share things open it machine able since programmed things told do like computers ai replace us would however complement us make daily work easier less timeconsuming without humans themselves future aiblackcoffer insights 29 amara arora vaanya kaushal scottish high international school,65,32,0.3402061820597301,0.8508771855186212,11.8,0.12647299031618248,4.7705891961264735,12.011764705882353,1084,8370,8017,3,1.0
