,URL,Title,Content,Positive_Score,Negative_Score,Polarity_Score,Subjectivity_Score,Average_Sentence_Length,Percentage_of_Complex_Words,Fog_Index,Average_Number_Of_Words_per_Sentence,Complex_Words,Word_Count,Syllable_Count_,Personal_Pronouns,Average_Word_Length
58,https://insights.blackcoffer.com/how-to-increase-social-media-engagement-for-marketers/,How to increase social media engagement for marketers?,social media staple evolving digital culture it’s almost hard imagine time without updates likes comments shares people concerned food looks tastes thus become necessary brand social media presence phrase “out sight mind” never apt today’s time social media much engagement people sharing content it’s call “social” mediasocial media engagement simply interaction customer brand social media platforms else going find huge database target demographic already mind frame read click on share messagein practicality oneoff communication construction longterm relationship target customers hence talk relationship imperative consider positive actions users reaction brand’s engagement tacticsa fundamental customer journey envisaged form customer funnel touchpoints available every step shown as awarenessconsideration decisionpurchase postpurchase touchpoints word mouth social media regular advertisements customer journey map congruence perceived offered benefits costbenefit analysis value propositionplace time utility loyalty towards product switching costs retailonportal conversion levers customer schemes dissonance purchase complexity understand reach social media use numbersmost popular social networks worldwide july 2020 ranked number active users in millionshow many retweets twitter many reactions post facebook many likes instagram many shares linked in seems new age resumethus good question mystery brand measure social media engagement online actions it’s often difficult measure offline benefits often online campaigns drive conversions dayweek user may see posts become familiar brand familiarity later on might result choosing brand unknown competitor social media engagement result helps businesses developing brand’s personality improves visibility becomes voicecustomers exhibit dynamic behavior based type product could range picking varietyseeking high involvement processes comprising extensive information search top mind recall rules due purchasing behavior implies targeted advertising marketing extremely important one engagement strategy applied across brands brand’s strategy must differ based brand trying sell target customers beliefs brandsome key aspects marketing strategy influenced vital cogs digital marketing wheel areinfluencer marketinginfluencer marketing involves brand collaborating online influencer market one products services audience doesn’t care much brand opinions influencersan influencer someone hasthe power affect purchasing decisions others knowledge position authority relationship audiencea following distinct niche regularly engage size following depends size topic niche2017 saw chanel named influential luxury brand social media since then continued grow diversify portfolio providing constant engagement plethora followers especially instagram crosschannel marketingcrosschannel marketing multichannel marketing practice using multiple channels reach audience everyone uses every single platform it’s good idea presence few share content across different networks makes difference marketing strategy choice platforms apart using basics like facebook instagram twitter clever use spotify youtube igtv showcase brand make real differencethe luxury vehicle brand land rover’s crosschannel marketing includes google display network homepage masthead masthead lightbox ads youtube visibility mobile search google brand’s digital campaign included four different influencers created visual content blogs taking trips places like glacier national park appalachian mountains land rover’s microsite crosschannel efforts resulted 100 million impressions youtube 10 increase search ad ctr results found online leads digital channel efforts account 15 brand’s total salesinformativethe content created social media must add value addition customers brand must constantly keep informing customers existing products new products achievements brands even casual content “wow didn’t know this” factor become regular followers brandan example would cosmetic brand posting makeup tutorials fenty beauty one prime example built 14m followers within 4 days launch eventually garnering close 10m followers rihanna one iconsinvolving customers  engaging them“customer king” known concept foundation traditional marketing shift social platforms brands must forget them understanding needs addressing them inviting respond take part brand’s online activities keeping interesting entertaining customer keyfounder ceo glossier emily weiss described brand as “the first sociallydriven beauty brand” glossier certainly pioneer term ‘instagram brands’ – using platform build awareness also focused conversation customer glossier often crowdsources product development asking instagram followers they’d like see next dynamicthe content creation must dynamic suitable current season festival event happening people must able relate posts must get excited seeing itstarbucks marvelous job comes dynamic oneoff recipes continuous hype around seasonal events related drinks silver ipa effectiveness award social strategy 2018 launch iconic ‘unicorn frappuccino’ spurred trend brands deliberately creating ‘instagrammable’ food drink result 557232 posts using hashtag pumpkinspicelatteproduct focussednow course real motive behind marketing activity eventually sell product becomes extremely important lose essence product marketing simple terms content strategy must leave customer confused brand actually trying sellto support productcentric statement oreo best example oreo’s social media strategy never diverged original formula completely productfocused yet always creative brand continuously finds ways put cookies center stage ‘daily twist’ campaign mark 100th birthday saw brand turn oreo cookie something cultural relevance 100 days including elvis presley baseball rainbow flag support pride visuals“a picture worth 1000 words” adage never apt age social media visuals important marketing strategy talk product day you’re able put front someone’s eyes it’s going nearly effect visual content marketing great way make happen broken six basic types comics memes infographics photos videos visual notetakingcocacola leader trendsetter visual content marketing space years 2020 initiative video paved way multiway communication opposed single way process prevalent product demonstrationthe barrier electronic platforms always loss touch customers often complain till don’t touch try test product convinced want purchase it also true products new customers need educated use hence becomes important brands bridge gap far possible online mediumproduct demonstrations considered one promising upcoming applications ar technology giving brands way provide immersive experience consumers gucci partnered snapchat first global branded ar shoe try lens hugely increasing fanfaresocial messagecorporate social responsibility missed comes social media engagement brand reach spread awareness must use it creating content spread social awareness adds emotional touch too customer connects brand emotional level hard competitors break itdove’s steady impactful social message still stands marketing that’s marketing ‘real beauty’ campaign refreshed multiple times since first launched 2004 dove’s latest campaign highlighted core message going far beyond surface aesthetic focus beauty real human values ‘courage beautiful’ campaign successfully honored healthcare workers working selflessly throughout 2020 pandemicthe fact remains share mind voice key elements dominant force world today social media marketing leveraged elements made presence felt every customer engagement finding unique ways really stand among competition key successful digital marketing strategy newer customized tools feel pulse market come every single day meet everchanging needs marketing heads end day ‘customer indeed king’ companies would well remember it blackcoffer insights 19 debmalya banik chowdhuryxlri jamshedpur tanisha guptaxlri delhi,47,14,0.5409835976887934,0.5350877146044938,11.438202247191011,1.5840068577026696,5.208883641957473,10.854166666666666,12935,7947,100519,0,1.0
59,https://insights.blackcoffer.com/impacts-of-covid-19-on-streets-sides-food-stalls/,Impacts of COVID 19 on Streets Sides Food Stalls,petty entrepreneurs like streetside food stalls form essential part economy plays significant role balancing development nation’s economy importance street food vendors helps increasing country’s per capita income also helps make living unemployed society limited investment sole breadwinners families so covid19 wreaking havoc uncertainty lockdown policies increased concern people hygiene lack investment upgrade businesses provide better hygiene facilities take away food mouths various states provided relief packages support but country populous ours hardly appropriately implemented delhi instance recently announced rupee 500 million stimulus package nearly 500000 rupees recognizing severe consequences loss livelihoods seller’s intended remedy credit loan provides sellers initial working capital rs 10000 enough instead loans government consider converting directly income benefits cash subsidies secure livelihood order initiate incomegenerating activities regular basis sellers need income support get back work can’t never able repay loan amount everchanging crisis organizations need take step forward ensure providers provided resources need make living pandemics vast economic impact every sector vulnerable sectors street vendors suffer most decreased income affect necessities payments family yourself due lack fixed salaries stalls cannot quit jobs possible might days unlike regular employees them risk infection far less frightening hungerunlike many businesses food vendors lack infrastructure go online sell products platforms like swiggy zomato“regret going digital before” says dilip das street side food stall owner sector v kolkata dilip das used run small streetside food stall provided meals employees around area filled multinational companies booming business till arrival covid lockdown arriving almost companies opted work home policies dilip tried start deliveries lack support fear infection business ended even startedciting similar reasons swapan mondal runs south indian food stall park street said know operate smartphone since sales good care learning either implementation lockdown took place within 4 hours people like swapan barely time cope changesfurthermore covid 19 pandemic made people realize important trains life train network suspended entire supply chain disrupted hundreds quintals food products rotted away awaiting logistical issues fix many businesses could afford run without proper supplies wellto handle issues vendors organizations may consider following solutionspromotion livelihood vendors including sellers nonessential goodsthe impact covid19 extremely severe informal workers ran capital income try feed long embargo sellers need able resume sales order survive governments need take steps reopen market bring sellers back businessreopening markets keeping mind social distancing hygieneindia different types traditionally crowded markets even weekly markets fresh food cooked food essentials daily roadside markets markets reopen need social distance mind government needs publish guidelines that future sales areas also need designed social distance need adequate sanitation running water wash areas toilets mind authorities need work town bending commission tvcprovision direct support devoid existing registration requirementsonce restrictions lifted impact covid 19 somewhat manageable sellers home months need direct income benefits help return work government initiative welcome move terms type bailout eligibility enough addition registered providers india government relief support must separated strict registration requirements delhi alone approximately 300000 street vendors approximately 13100 sort professional id types cash grants livelihood support standards relate job identification state government must also accept registration workers’ organizationsunions behalf governmentissued sales badgesensuring social distancing proper sanitation hygiene sites businessesthe government municipal corporations need take initiative running water soapsanitizers need provided street vendors place work moreover streetside food vendors work food safety authorities country train different ways maintain hygiene whilst workingtaking steps spread awareness different government initiatives reliefsmany small businessmen food vendors even know rights benefits claim did many still idea claim them proper awareness camps need set help smalltime food vendors know get assistance help government return back businesswhen covid unknown word shopkeepers vendors brought taste mouth gave us memories live for filled bellies quenched thirst needed them it’s time provide hand need itblackcoffer insights 34 sarthak satyabrata mishra abhijit kundu symbiosis institute management studies pune,28,28,0.0,0.4912280658664205,13.170212765957446,2.686744519565663,6.342782914209244,13.404255319148936,13114,4754,102087,2,1.0
60,https://insights.blackcoffer.com/coronavirus-impact-on-energy-markets-2/,Coronavirus impact on energy markets,coronavirus also known covid19 global public health emergency also source significant regional increasingly global economic disruption impacts energy climate world many ways economic downturn puts pressure global oil prices leading organization petroleum exporting countries opec consider cuts production hurts demand natural gas time extremely low prices changes economic energy climate policymaking environment china one consequential energy consumers sources greenhouse gas emissions temporarily disrupted supply chains throughout energy industry including renewable energy time supply chain connections china revaluated due ongoing tariff trade disputes consequential transformative changes energy sector climate efforts depend upon ultimate trajectory virus outbreak itself— sarah ladislaw senior vice president director energy security climate change programthe energy sector already felt impacts coronavirus outbreak contributed dampened demand oil resulting plummeting oil prices production declines move forward then energy sector expects face two headwinds managing issues health emergency sectors face simultaneously coping low oilprice scenario lower demand need shore revenue manage debt obligations impact covid19 indian energy marketsin india distribution utilities lower tariff domestic agricultural consumers sometimes even average cost supply compared commercial industrial consumers table 1 provides electricity tariff rates delhi selected consumer categories highlight differences thus several distribution companies lower tariffpaying consumers crosssubsidized commercial industrial consumerscategoryfixed charge ₹ kvamonthenergy charge ₹ kwhindustrial250775single point delivery supply group housing societies150450agriculture125150table electricity tariff schedule fy201920 – delhi electricity regulatory commission dercthe covid19 lockdown led shut essential commercial activities across country approximately 13 billion citizens obliged remain within confines homes and many cases allowed work home consequently electricity demand industrial and commercial customers reduced significantly residential demand expected increased according power system operation corporation india posoco energy met march 16th 2020 – considered businessasusual scenario – 3494 mu compared 3113 mu march 23rd 2020 day voluntary curfew reduced range 26002800 mu march 25th march 31st 2020 trend illustrated figure 1figure1 daily energy met muthus firstly key risk covid19 pandemic already struggling distribution companies india arises loss revenues due reduction demand commercial industrial customers well inability cover crosssubsidies provided lowertariff paying consumer secondly utilities would also account expense comply ‘must buy’ commitments generators longterm power purchase agreements true full extent risk would known quantitative analysis conducted crisis situation contained thirdly operational level distribution companies would account deviation demand supply patterns temporal locational level finally period critical infrastructure electricity networks would run minimum employeescovid19 impact power marketas seen figure 1 trade wholesale power market comprises 43 percent total electricity transactions however transactions power exchanges grown last decade indian energy exchange iex seen growth 2616 mu fy 2009 52241 fy 2019figure2 share market segments total electricity generation 201819 source cerc now trade wholesale market four market segments1 dayahead market 2 term ahead market 3 renewable energy certificates4 energysaving certificates recently central electricity regulatory commission cerc finalized regulations implementing realtime markets halfhourly market enable intraday trade electricity allowing adjustment generation consumption profile day covid19 pandemic announced cerc realtime market would operational april 1st 2020 however starting date delayed two months june 1st 2020 according media reports due covid19 pandemic required trials could completed delay realtime market implementation likely serious adverse impact indian power marketanother impact covid19 pandemic power markets terms market dynamic observed dip clearing volume marketclearing price coincides gradually increasing shutdown measures taken government response covid19 see figure 2 thus reduction demand due lockdown reflected volumes traded electricity market clearing priceanother point reference price clearing volume 2019 march 22nd 2020 day voluntary lockdown clearing volume 9705 gwh clearing price 219548 ₹ mwh comparison day 2019 clearing volume 10798 gwh clearing price 281618 ₹ mwh start lockdown march 25nd april 1st 2020 average clearing volume 10427 gwh compared 13024 gwh 2019 period similarly average market clearing price 215593 ₹ mwh 2020 compared 3371025 ₹ mwh 2019 period views shareholders indiathe lockdown resulted shutdown industrial commercial establishments stoppage passenger railway services adversely impacted india electricity demand given segments constitute 40 india electricity demand statement issued rating firm saidfurther segments account even greater percentage discoms sales revenues given subsidizing segments apart focus state governments healthcare relief measures likelihood subsidy support discoms getting deferred cannot ruled out addedicra ratings group head senior vice president – corporate ratings sabyasachi majumdar said “the lockdown imposed government likely adversely impact india electricity demand demand expected decline 2025 yearonyear basis period lockdown would turn adversely impact revenues cash collections distribution utilities near term especially given consumption decline high tariff paying industrial commercial consumers likely delays cash collections consumer segments revenue deficit discoms estimated rs 130 billion per month india basis would turn adversely impact liquidity profile discoms increase subsidy requirement lead delays payments power generation transmission companies”the power ministry friday issued directors central electricity regulatory commission provide moratorium three months discoms payments power generation transmission companiesthe power ministry friday issued directors central electricity regulatory commission provide moratorium three months discoms payments power generation transmission companies requested state governments issue similar directions state electricity regulatorsthe power generation companies already suffering delays payments discoms across majority states payment due rs 85000 crore november 2019 india level per data praapti portalwith covid19 lockdown accentuating delays payments availability adequate liquidity buffer form debt service reserve undrawn working capital limits remains important credit perspectivehowever said relief measures moratorium debt servicing 3month period notified reserve bank india expected moderation interest rate cycle would source comfort near term timely approval moratorium boards banks financial institutions remains crucialthe revenues power generation companies longterm power purchase agreements ppas state distribution utilities discoms protected provision capacity charges linked plant availability case thermal large hydropower projects “mustrun” status case nuclear renewable power projectsaverage monthly thermal plf would dip 5052 63 corresponding period previous year due considerable drop demand consequently power generation companies especially without longterm ppas would adversely impacted given weakening power tariffs shortterm  power exchange market said icra ratings sector head  vice president girishkumarkadamthe underconstruction renewable power projects well epc manufacturing companies solar segment likely face execution delays disruption supply chain india labor availability following lockdown given import dependency china sourcing pv modules execution timelines ongoing solar projects likely affected delays delivery pv modules following outbreak covid 19 chinathis delay turn would increase preoperative expenses overall project cost turn would impact expected returnsin context mnre notified time extension provided renewable energy projects impacted supply chain disruption due covid outbreak force majeure clause“given execution headwinds amid covid 19 affecting q1 fy202021 assuming normalcy thereafter capacity addition wind solar segments together likely degrow 25 thus estimated 8 gw earlier estimates 11 gw fy202021” said kadamfigure cleared volume above market clearing price below iex march 17th – april 1st 2020blackcoffer insights 17 tpragyna ece gitam university,18,41,-0.38983050186727963,0.5175438551092645,13.683544303797468,1.5278091792900745,6.084541393235018,14.126582278481013,13515,8582,104826,0,1.0
