,URL,Title,Content,Positive_Score,Negative_Score,Polarity_Score,Subjectivity_Score,Average_Sentence_Length,Percentage_of_Complex_Words,Fog_Index,Average_Number_Of_Words_per_Sentence,Complex_Words,Word_Count,Syllable_Count_,Personal_Pronouns,Average_Word_Length
31,https://insights.blackcoffer.com/can-robots-tackle-late-life-loneliness/,Can robots tackle late-life loneliness?,era everyone busy life one spares time someone robots tackle life loneliness time stand stare causes loneliness loneliness due fastmoving life hurry worry 21st century everyone spending time earning money daybyday transforming moneyearning machines due perception losing relations can’t give enough time families busy earning livelihood never get satisfies always want more everyone race earning sends children far away make well settled order maintain status one faces consequences kind lifestyle old age people usually don’t spend time children children childhood yearn company children old age feel lonely none talk with still attached people places belongings memorable events past although understand life cannot continue way earlier may easily result feelings loneliness social isolation become older need attended order meet daily needs robots indeed serve purpose aid mechanical care emotionless feeling fewer entities robots aren’t creative work according preprogrammed system till software created transfer human feelings robots major loophole using robots tackle latelife loneliness undoubtedly serve masters masters can’t share feelings incapable understand react them can’t change activity according occasion provide anything except emotional satisfaction without emotional gratification loneliness can’t tackled master attached robot attachment due service can’t share thoughts them era rendered lonely late life feel need companion talk feel need someone listen us react advise us tackle daytoday life problems can’t find one have undoubtedly achieved great progress terms technology never fill void heart person struggling latelife loneliness advancements kind mental trance experience fame progress wealth etc gain consciousness find lonely world relations life actual wealth person’s life never enjoy bond robot follow commands take appropriate care can’t react emotions can’t console us man lives loneliness long time eats conscience transforms machine robots never become friends crack jokes weep tears establish emotional connection us can’t understand feelings many people go depression depression occurrence depressive symptoms prominent condition amongst older people significant impact wellbeing quality life remain sick loneliness directly impacts longevity lonely people often think longer needed world thus want die impacts mental psychological social physical health robots prove useless matters provide motivation software can’t themselves react situation don’t know anger happiness sadness don’t bring food master hungry commanded so can’t even offer glass water themselves man living without relations without fellow feeling longer remains human being becomes none less machine as due loneliness becomes mentally ill goes condition like trauma longer enjoys nature’s blessings becomes happy sad loses ability react hence can’t act it’s dangerous situation face plethora challenges assisted living facilities addressed emotional needs neglected forcing withdrawal social activities relations life interaction fellow beings sharing joy happiness fellow feeling make man mere ‘being’ ‘social being’ finally human beingblackcoffer insights 22 ishatpreet singh iiser mohali,21,24,-0.06666666518518523,0.3947368386426593,7.927272727272728,2.0021135265700485,3.9717545015371103,7.803571428571429,6631,3200,51376,4,1.0
32,https://insights.blackcoffer.com/embedding-care-robots-into-society-socio-technical-considerations/,Embedding care robots into society and practice: Socio-technical considerations,care robots name suggests robots used hospitality purposes like fetching water cracking jokes keeping patient good harmony etcthe senior care industry forefront quite period reason being nuclear families becoming busy schedule one day parents nuclear family old children nowhere take care of instead nursing homes become trend parents mental illness put rehabas observed decades robots taking care many activities even dominating fields like automobile industry so machines indeed help humankind achieving remarkable success many fieldsdo senior citizens love machines  look watch tv love play video games smartphone so give humanlike structure ability smartphone make people happy would quite monstrous featblackcoffer insights 22sadhana kanaparthi kiams,9,2,0.636363578512402,0.09649122722376116,10.5,8.55655526992288,7.622622107969153,9.909090909090908,6657,755,51626,0,1.0
33,https://insights.blackcoffer.com/management-challenges-for-future-digitalization-of-healthcare-services/,Management challenges for future digitalization of healthcare services,management acts guide group people working organization coordinating efforts towards attainment common objectivemanagement challenges future digitalization healthcare servicescharacteristics future digitalization healthcareuniversal organizations whether profitmaking not require management managing activities hence universal naturegoaloriented every organization set predetermined objective management helps reaching goals timely smoothlycontinuous process ongoing process tends persist long organization exists required every sphere organization whether production human resource finance marketingmultidimensional management confined administration people only also manages work processes operations makes multidisciplinary activitygroup activity organization consists various members different needs expectations beliefs every person joins organization different motive becoming part organization work achieving goal requires supervision teamwork coordination way management comes picturelevels managementtoplevel management highest level organizational hierarchy includes board directors chief executives responsible defining objectives formulating plans strategies policiesmiddlelevel management second important level corporate ladder creates link top lowerlevel management includes departmental division heads managers responsible implementing controlling plans strategies formulated top executiveslower level management otherwise called functional operational level management includes firstline managers foremen supervisors lowerlevel management directly interacts workers plays crucial role organization helps reducing wastage idle time workers improving quality quantity outputfuture digitalization healthcare current day age wave digitization taken world emerging technologies like artificial intelligence others helping people live better easier life service sector also benefited lot digitization got boost prime minister narendra modi year 2015 launched campaign known ‘digital india’ among various industries service sector digitization massive impact operation healthcare diagnostic industry helped development industry enhances life millions people condition india terms healthcare quite grim patients need attention neglected unable avail proper treatment diagnosis however coming digitization hoped industry alsoaccording dr keshab panda ceo  md lt technology services three trends emerging healthcare diagnostics ecosystem result digitization1 valuebased healthcarethis model healthcare doctors hospitals paid based patient health outcomes coming digital tools segment healthcare considered starting tool dr panda says implementation advanced digital technologies patientcare domains like mobile health apps telehealth wearables remote monitoring help enhancing accessibility boost efficiency augment effectiveness treatment preventive care2 new product developmentthe healthcare industry past decades changed drastically coming emerging technologies new surgical procedures medical devices made available3 connectivitywhile talking connectivity healthcare dr panda said digitization taking industry matter time help internet smartphones digital healthcare everywhere internet helped doctors connect patients also one another helped enhancing doctorpatient engagement increasing interaction timebig data aggregates information business formats social media ecommerce online transactions financial transactions identifies patterns trends future usefor healthcare industry big data provide several important benefits includinglower rate medication errors – patient record analysis software flag inconsistencies patient’s health drug prescriptions alerting health professionals patients potential risk medication errorfacilitating preventive care – high volume people stepping emergency rooms recurring patients also called “frequent flyers” account 28 visits big data analysis could identify people create preventive plans keep returningmore accurate staffing – big data’s predictive analysis could help hospitals clinics estimate future admission rates helps facilities allocate proper staff deal patients saves money reduces emergency room wait times facility understaffedchallenges future digitalization healthcare 1 cybersecurityalthough ransomware data breaches cybersecurity concerns nothing new healthcare industry 2020 covid19 pandemic revealed vulnerable sensitive patient health information really isthe recent growth digital health initiatives like telehealth doctor visits — major contributor severe increase breached patient records healthcare functions continue move online next year it’s extremely important ensure processes protected outside threats2 invoicing payment processingmedical practices citing patient collections top revenue cycle management struggle patients becoming responsible larger portion medical bills order help encourage patients submit payments timely manner providers must adhere patient payment preferencesto meet patient expectations improve user experience ensure billing statements patientfriendly offer paperless statements variety payment options eg credit card etc via online patient portal utilize latest payment technologies mobile texttopay new features like text email reminders help effectively communicate patients encourage pay financial obligations3 patient experiencethe medical insurance landscape experienced significant changes recent years patients responsible larger portion healthcare bill naturally demand better services providershealthcare organizations face tougher competition attracting retaining patients demand experience matches level customer service expect consumer brandsthey demand streamlined patient experience “selfservice” resolve questions issues concerns eg downloading immunization record booking appointment paying bills checking accountinsurance status whenever wherever however convenient themblackcoffer insights 22 priyam verma riya malik,48,14,0.5483870879292405,0.5438596443521084,9.884057971014492,1.1355987583728149,4.407862691754923,10.333333333333334,6951,5944,53675,0,1.0
34,https://insights.blackcoffer.com/are-we-any-closer-to-preventing-a-nuclear-holocaust/,Are we any closer to preventing a nuclear holocaust?,one thought always comes mind…what lived without dander hanging headsand know danger is 70 years world faced real threat nuclear warnuclear war real growing threat united states russia left critical agreements treaties actively planning add new types weapons arsenalsmeanwhile us nuclear policy remains rooted cold war increasing risk nuclear weapons could used againit doesn’t way right policy changes commitment diplomacy united states leader reducing nuclear threat also help them question arises activities done prevention nuclear holocaustand pressuring congress support changeholding white house accountable independent research analysisincreasing public demand changing nuclear weapon policiesnow question prevent nuclear holocausttell government don’t fund nuclear arms racecall investment public health public security nuclear weaponstell government united states never start nuclear warurge presidential candidates make preventing nuclear war priority activist resourcesnuclear weapons extremely strong show power nation one knows drawback attack two countries example hiroshima nagasaki realistic bomb blast explained blood people crux presentation circumstances surrounding nuclear war call new level commitment scientific community reduce risk nuclear war generate new options decreasing risk need analytical work people know weaponry military uses far enough job also need scholars know superpowers indepth people know nuclear powers people know thirdworld flashpoints people know international relations broadly people know lot policy formation implementation especially superpowers people understand human behavior stress especially leadership stress people understand negotiation conflict resolution people much more words relevant knowledge skills cut right across physical biological behavioral social international physicians prevention nuclear war world health british medical association american medical association others contributed well central point kind awakening occurred medical community responsibility addressing immense nature threat public health last want conclude that “ nuclear war except evil force one winner science humanity become villain everyone knows gamblers want play cards aware nuclear gamblers “i hope soon world full love affection place hate wars heldblackcoffer insights 21 rutika pagar cmcs college nashik,12,14,-0.07692307396449716,0.22807017343798094,9.838709677419354,2.9089410795220436,5.099060302776559,9.411764705882353,7060,2358,54447,2,1.0
35,https://insights.blackcoffer.com/will-technology-eliminate-the-need-for-animal-testing-in-drug-development/,Will technology eliminate the need for animal testing in drug development?,imagine speak one comprehend you kept captivity place hardly breathe finally selected taken place happy moment you finally freedom sadly instead free prodded rods fed toxic substances will thing scream vain voice heard everyone gets lost noise scientific advancement writhe pain substances take effect body pain slowly creeps body slowly succumb it never wake again since time aristotle animals subjected various inhumane experiments sake knowledge experiments though unethical necessary advancement science animal testing become important part experimenting living organisms ensure product safe humans consume lab animals generally subjected high levels toxicity kept isolation due suffer lot stress discomfort animal testing large number drawbacksanimals human beings react differently certain substances example 2004 vioxx withdrew “rofexocib” 80000 people suffered heart attacks taking drug although drug showed effects animal testing posed threat human beings costly conduct animal testing animals need provided shelter food large period trials completed animal testing might lead scientific breakthrough various instances animal testing failing achieve desired result ultimately leads loss time resources money products like cosmetics may essential humans therefore don’t require animal testing all cosmetic industry notorious animal testing products it’s pity products aren’t even launched marketall things make us question ourselves even worth it possible stop cruelty without hampering growthwith advancement science made possible don’t use animals ever again advanced computing– availability various software programs become easier understand working biological organism replicate entire human body conduct various tests get generate simulations assess possible effects chemical biological reaction example cadd computeraided drug design becoming popular stimulating whether particular drug affects cells not cuts requirement using animals testing also reduces experimentation time researchers don’t wait animals show response tissue culture – growing tissues petri dishes vitro cells viable alternative animal testing tissues cells brain liver kidney etc taken animal kept suitable growth medium weeks even year cultures used test toxicity efficacy substances example eye irritancy tests new animals used experiment check substance irritating eye not many animals permanently lose eyesight using new animal every time simply inhumane using bovine corneal organ culture corneal tissue cultured three weeks using yields result without complications scientists started use method test toxicity efficacy cosmetics drugs chemical sectors 3d printing– making complex tissue structures single digital file astonishing printing tissues help carrying experiments getting results similar real tissues example earlier animal organs charts 3d models used explain functioning particular organ medical students bioprinting companies started making human tissues organs used students various medical schools understand intricacies human organs helped bringing animal experimentation large extentthese bioprinted models also used researchers conduct experiments without using animals it french company working bioprinted liver model test liver toxicity without use animals all breakthrough field biotechnology bring animal experimentation large percentage organonachip method – fairly new technology consists growing cells inside chips imitate structure behavior human organs researchers test drugs chips far cheaper humane testing animals example uk company cn bio come system consists 10 organs single chip tissues ranging liver brainmicro dosing humans participate experiments injected small one time doses constantly monitored imaging techniques gather information changes happening body tests replace certain tests animals help removing drug compounds don’t desired effect human body example covid19 tests carried human volunteers given small doses vaccine kept constant surveillance helped researchers removing drugs desired effect human body thus also able remove animal testing one processesthese alternatives help bringing animal experimentation large extent science progress without harming animals go rather putting excruciating pain must protect animals much else would soon living world without them blackcoffer insights 21 eeshan singh sowmya k p icfai business school hyderabad,21,32,-0.2075471658953365,0.46491227662357654,11.68,1.6169309805673442,5.318772392226938,11.326923076923077,7239,4387,55861,1,1.0
