,URL,Title,Content,Positive_Score,Negative_Score,Polarity_Score,Subjectivity_Score,Average_Sentence_Length,Percentage_of_Complex_Words,Fog_Index,Average_Number_Of_Words_per_Sentence,Complex_Words,Word_Count,Syllable_Count_,Personal_Pronouns,Average_Word_Length
84,https://insights.blackcoffer.com/why-scams-like-nirav-modi-happen-with-indian-banks/,Why scams like Nirav Modi Happen with Indian banks?,india beset financial scams since independence every 45 years indian citizens hear many trillions public money misappropriated eventually lost people public supposed start article examples would like point two factors scams like nirav modi complicity actors within financial industry systemic loopholes emerging financial system used scams like nirav modithe first financial scam independent india found 1958 feroze gandhi mp found 1957 haridas mundhra got governmentowned life insurance corporation lic invest rs 124 million about us32 million time shares six troubled companies mundhra held large number shares trying boost rigging market investment done governmental pressure bypassed lic’s investment committee informed decision deal gone through event lic lost money several leading stockbrokers lic investment committee testified investment could made purpose propping market claimed finance ministry lic consulted investment committee would pointed mundhra’s forged shares episode 1956 finance minister t t krishnamachari testimony tried distance lic decision implying may taken finance secretary justice mc chagla held minister constitutionally responsible action taken secretary disowns actions eventually krishanamachari resign nehru government suffered considerable loss prestige incidentthe 1992 indian stock market scam stock market scam orchestrated harshad mehta scam took place mumbai biggest market scam india 1992 scam systematic stock fraud using bank receipts stamp paper caused indian stock market crash scam lead complete structural change security system india introduced completely new system stock transactions 1992 scam exposed indian financial systems inherent loopholes system scam led reform security system india introduced online security systems scam orchestrated way mehta secured securities state bank india forged cheques signed corrupt officials failed deliver securities mehta made prices stocks soar high fictitious practices would go sell stocks owned companies 1992 scam raises many questions involved many bank officials responsible collusion mehta 1992 scam caused investigation many officials implicated fraudulent charges security system india took rapid reform fundamental structure post 1992 scam first major structural change formation national stock exchange india nse first major reform financial sector india formation cii code desirable corporate governance developed rahul bajaj post1992 new regulatory board known securities exchange board india formed monitor national stock exchange national securities depository structural changes equity market government introduced ten acts parliament one constitutional amendment based upon principles economic reform legislative change equity market nse introduced online trading 1994 changed dynamics stock buying selling capital market opened nationally opposed confined mumbai exchange system started functioning based satellite communications abolished geographical barriersin 2001 ketan parekh purchased large stakes less known small market capitalization companies jacked prices circular trading traders collusion companies large institutional investors resulted steep hikes share prices later transpired promoters industrialists often gave parekh funds artificially rig share prices set ten stocks colloquially referred “k10” stocks parekh playfully referred “pentafour” rbi commenced investigation parekh around time bear cartel brokers mumbai opposed parekh tried dump shares k10 stocks panicking parekh sold entire ownership socalled k10 stocks successfully jacked past two years resulted stock market crash next day resulting largescale losses large institutional investors including insurance companies mutual funds 30 member joint parliamentary committee jpc investigation ensued found parekh involved circular trading throughout time period variety companieswhen securities exchange board india sebi started scanning entire spectrum ipos launched 2003 2004 2005 ended digging dirt probably prevented larger conspiracy hijack market involved manipulation primary market—read initial public offers ipos—by financiers market players using fictitious benaami demat accounts transferred shares financiers sold first day listing making windfall gains price difference ipo price listing price time fraudsters targeted primary market make quick buck expense gullible small investors direct participants dps used retail applicants’ shares reaping benefits stock marketthe 2010 fake housing loan india uncovered central bureau investigation cbi india cbi arrested eight topranking officials public sector banks financial institutions including lic housing finance ceo ramchandran nair connection scam cbi alleged officers various public sector banks financial institutions received bribes private financial services company acted mediator corporate loans facilities financial institutions bank officials sanctioned largescale corporate loans realty developers overriding mandatory conditions approvals along irregularitiesthe thane police struggling crack tax refund scam taken income tax department ride defrauded central exchequer around rs 3 crore concluded scam involved highranking officials it department state bank india fraudinvolving two it offices thane kalyan planned familiar it office functioning two years 20072008 20082009 it officials disbursed tax refund cheques drawn sbi credited account fictitious assessees credit society dombivli many 331 tax refund cheques exceeding rs 1 lakh subsequently routed dombivli nagri cooperative bank funds withdrawn it refunds account payee cheques can’t transferred despite this 331 refund orders credited thirdparty account credit societythe saradha group financial scandal major financial scam alleged political scandal caused collapse ponzi scheme run saradha group consortium 200 private companies believed running collective investment schemes popularly incorrectly referred chit funds eastern india feared legitimate nonbanking financial companies microfinance institutions would stigmatized leading vicious cycle low depositor trust higher interest rates lower lending localized credit crisis saradha group depositors came lowest economic strata loss investment would cause decrease social mobility scandal drew attention similar illegal deposit mobilizing companies facing increased regulatory pressure many companies variations timeshare travel schemes clear regulations august 2013 central government amended sebi act gave sebi powers search seize without prior magisterial permission investigate illegal money collection schemesnsel case relates payment default national spot exchange limited occurred 2013 involving financial technologies india ltd payment default took place commodities market regulator forward markets commission fmc directed nsel stop launching contracts led closure exchange july 2013 three spot exchanges nsel nspot national apmc exempted government section 27 fcra conduct forward trading oneday contracts done boost volumes economic viability improved flawed recommendations fmc ministry consumer affairs ordered nsel settle existing contracts launch fresh contracts led crisis investigations led enforcement directorate ed economic offences wing eow revealed role brokers defaulters nsel case brokers missold nsel products clients assuring fixed returns defaulters hypothecated stocks produced fake warehouse receipts siphoned entire default money fiu under finance ministry held nsel came purview forwarding contracts regulation act fcra therefore guilty failing several obligations law black money watchdog slapped penalty rs 166 crore several counts violating provisions prevention money laundering act pmla nsel watchdog held failures deliberate willful hence invite penaltiesthe nse colocation scam relates market manipulation national stock exchange india india’s leading stock exchange allegedly select players obtained market price information ahead rest market enabling frontrun rest market possibly breaching nse’s purpose demutualization exchange governance robust transparencybased mechanism alleged connivance insiders rigging nse’s algotrading use colocation servers ensured substantial profits set brokers whistleblower alleged trading members able capitalize advanced knowledge colluding exchange officials written reply minister state finance arjun meghwal told lok sabha 2016 “the architecture nse respect dissemination tickbytick transmission control protocol tcp internet protocol ip prone manipulation market abusethe punjab national bank fraud case relates fraudulent letters undertaking worth ₹1135684 crores us 14 billion issued punjab national bank brady house branch fort mumbai making punjab national bank liable amount fraud allegedly organized jeweler designer nirav modi nirav wife ami modi brother nishal modi uncle mehul choksi partners firms ms diamond r us ms solar exports ms stellar diamonds along pnb officials employees directors nirav modi mehul choksi’s firms named charge sheet cbi bank initially said two employees branch involved scam bank’s core banking system bypassed corrupt employees issued lous overseas branches indian banks including allahabad bank axis bank union bank india using international financial communication system swift 1 march 2018 government approved fugitive economic offenders bill deter economic offenders evading process indian law giving powers government confiscate assets fugitive including benami assets absconding loan defaulters bill covers wide range economic offenders include loan defaulters fraudsters individuals violate laws governing taxes black money benami properties financial sector corruption march 2018 reserve bank india scrapped banking instruments letter understanding lou letter comfort loc attempt plug loophole improve banks’ due diligence trade credit bankers said lous locs led receiving banks depending completely issuing bank creditworthinessas seen cases scams like nirav modi two factors action taken insiders systemic loopholes responsible majority indian financial scams improvement industry come loopholes closed accountability given held people working industryblackcoffer insights 16 sandeep chakravartty publicis sapient,47,80,-0.2598425176390353,1.1140350779470607,13.822916666666666,1.7447519083969465,6.227067430025445,14.010416666666666,18285,10215,141555,2,1.0
85,https://insights.blackcoffer.com/impact-of-covid-19-on-the-global-economy/,IMPACT OF COVID-19 ON THE GLOBAL ECONOMY,14th march wasaltogether prepared last theater competition year knew core much competition meant me morning made lastminute calls diligent team ceaselessly practicing past days confirm coming competition alarming coronavirus ball game going outside market like wasn’t aware situation believed would able handle there’s quote theatre says “fear deep mind allows” length fearless passion fondness attachment theatre notices announcements we’re rolling outbut once received call mr sandeep head event told event put till next days precise moment onwards journey hard strenuous days began point fact felt like meant happen competition postponed team stuck homes grudgingly time haunting us coronavirus cardinal ways virus affected us sickness sickness acted like sadist impressed found someone could act better me reversed ways used work play exercise world solution asked practice professionals social distancing virus wild dangerous towards people declining health conditions obviously could take hands young people well coronavirus cases deaths heightening great extent also major problem came light people fully unprepared led public becoming snappier intolerant nonsupportive needless say virus acting like sadist means government knows best handle affairs decided shut schools colleges bars anything would involve gathering 10 people disinformation coming around related infection becomes hard judge audience true false worsens public consumes information working home virus hollowing people deep inside also supporting increasing countryrelated issues one fake news serious problemwith fake news traveling around world people come start blabber people start offering numerous solutions want people follow it start acting like saints know solutions pandemic solutions convenient follow unhealthy creates immense confusion arguments best way stop confusion avoid people avoid arguments convince points rightly said man convinced opinions still thing look family avoid shady deceitful peoplebut one thing can’t avoided expanding maturing industries lend hand developing nation power choose left industries standstill current moment coronavirus right winning game untold number industries growing major one tourism industries continues happen time loss jobs close 75 million many working people like tourism industry peculiar industry also various others people getting suspended hefty amount lost revenue one family members resorted issue working free next months order least protect job blamed kinds situations also point concern many people“massive hunger definitely kill poor virus” statement takes immediate attention options left dailywage earners would say option ones condemning situations lockdown us way relax listen karaoke lockdown means end life unquestionably decision prime minister best could take best turns worst someone think it’s moment question going internet writing what’s best way spend quarantine definitely what’s best way help people naturally would interest many people furthermore set become hell people start activity stockpiling unnecessary piling food altogether reason shortage ultimately hungermy maid mala housewife small suffering family believe could written article better manner would relevant education actual prey problem patient exactly know impact virus lives sitting homes cup coffee never let us know empty cup feels like mala said think much would tolerating prime minister apologized public lockdown certainly good thing masses could help provide family money eatables small contribution motivation call 2 days believe improve state completely would certainly provide power deal it mala family also millions people exact condition countless mala country panicking enduring suffering night food stomachs imagine exact situation yourselves would without fail hardest situation impact virus create sure article endless pages owing fact stories story ispainful otherlabor chowk noida numerous stories people conveying problems asking help chowk main know men looking work quite men gather morning get work order feed families least roti virus even snatched plates known movie indian cinemas “coolie” says laborers get pay till sweat dries up people anyhow need money day feed families uncontrollable situations times forced eat filth muck sickness might kill people hunger stained water definitely will stories never end it’s meant happen hope situation order provide relief themalso one would imagine movie “six feet’s apart” would acted reality solutions related pandemic came swiftly rapidly help support doctors nurses serving us sufferers roundtheclock solutions like washing hands least 20 seconds correctly covering mouth face mask majorly avoiding unnecessary wandering streets keeping away unhygienic people asked follow efforts doctors nurses government officials made realize passion notices announcements move hand hand it right moment moving circumstances nobody knows might happen future one thing sure nobody ever forget situation indeed ability knock event day many lessons learned world days never ever take anything granted thing person leaves life tends become like rock appreciate admire cherish whatever never know might leave you ask lost someone corona virus moments live happily world spend someone makes feel loved day sun rises new hope make habit feel warmth wish healthy life yourself family world together fighting virus unityblackcoffer insights 16tanishka gupta institute innovation technology management,44,55,-0.11111110998877667,0.8684210450138505,10.815384615384616,3.30951101558302,5.649958252387055,11.938461538461539,18477,5477,143338,6,1.0
86,https://insights.blackcoffer.com/impact-of-covid-19coronavirus-on-the-indian-economy-2/,Impact of coronavirus on the Indian economy,nathan wolfe impact said “thereare commonalities among pandemics occur learn fromthem one commonality comes animals one thatwe wait long”in year 1720plague year 1820 cholera outbreak recent pandemic thespanish flu 1920 researchers said pandemics abovehave exactly pattern coronavirus outbreak however theprecision pandemics occur exactly 100 years age makes usthink better topic coronavirus disease covid19 one infectious disease declared global pandemic who people infected covid19 virus experience mild moderate illness recover without requiring special treatment older people underlying medical problems like cardiovascular disease diabetes chronic respiratory disease cancer likely develop serious illnesses best way prevent slow transmission well informed covid19 virus disease causes spreads people protect others infection washing hands using alcoholbased sanitizer frequently touching face covid19 virus spreads primarily throughdroplets saliva discharge nose infected person coughs orsneezes it’s important also practice respiratory etiquettes forexample coughing flexed elbow etc time nospecific vaccines treatments covid19 however many ongoingclinical trials evaluating potential treatmentsthe first case pandemic india wasreported january 30th2020 increasedsubstantially around country extent indian primeminister announced 21day lockdown around countryrating agencies global domestic unanimous covid19 pandemic economic tsunami india even though country may slip recession unlike eurozone us asiapacific stronger trade ties china analysts believe impact india’s gdp growth significant fallout move spill financial year 2021 begins april 1 moody’s investors service march 27 sharply slashed projection india’s gdp growth calendar year 2020 53 25 markdown second 10 days came prime minister narendra modi announced 21day lockdown global macro outlook 202021 moody’s cited severe liquidity constraints india’s banking nonbanking sectors hindrance growth agency’s forecast global economy even stark—a contraction 05 ongoing financial year“lower business volumes occupancies andsuboptimal efficiencies impact profitability companies someaffected companies may initiate costcurtailment measures may beenough given high fixed costs could impair credit files”says subodh rai senior director crisil neeraj kumar migrant worker decided toflee family joined throng people leaving city soon thelockdown announcement made public transport systems stopped leavingpeople choice walk mr kumar wife 10yearolddaughter already walked 40km 24 miles spoke him“there work here running away nobuses walk another 260km get village” saidthe situation workers following lockdown better mohammad alam one thousands workers standing food queue india’s capital delhithefactory worked shut prime minister narendra modiannounced 21day lockdown stop spread coronavirusa dailywage laborer source income forced come government center food “i don’t know survive borrow feed family” saysindia announced 23bn £18bn relief package help people like mr alam mr kumar part india’s unorganized informal industry employs 94 population contributes 45 overall output industry already bearing brunt lockdown thousands finding unemployed overnight “noone allowed go hungry” finance minister nirmala sitharaman said announcing package – combination direct cash transfer benefits food security measuresbut economic fallout unprecedented lockdown dire businesses closed unemployment risen productivity fallen india’s growth engine actually sputtering well threat outbreak arrived one fastestgrowing economies world growth slowed 47 last year – lowest level six yearsunemployment 45year high last year industrial output eightcore sectors end last year fell 52 – worst 14 years small businesses begun recover controversial 2016 currency ban came body blow cashconsuming informal economy now experts say coronavirus outbreak likely cripple already frail economythere little finance minister nirmala sitharaman rbi governor shatikanta das covid19 forces virtual lockdown commercial hubs india like done china italy lights mumbai delhi alone nerve centers india cause great damage indian economy indeed covid19 massive blow slowing indian economy particularly small business sme sector recently shown improvement since demonetization took placethis warlike situation indian economy malls theatres empty schools shut contingencies states even announced complete shutdown services welcome government’s measures feel much needed done minimize economic impact “while free extra rations sanctioned poor access due them” wonders economist arun kumar“the government shoulddevise way using army state machinery physically distributefood poor” thousands migrant workers stuck miles away fromtheir homes seamless distribution cash food needs thegovernment’s top priority adds it’s migrant workers riskfarmers also vulnerable potential economic shock lockdown –the agriculture industry contributes nearly 265bn gdp thegovernment says give farmers 2000 rupees 30 april advancepayment 80 annual payout tide situation“this money inadequate exports stopped pricesin cities rise profiteering rural areas dropbecause farmers won’t able sell crop” says economist arunkumar outbreak happened critical farming time – new crop isready waiting sold economists warn india’s challenge transporting food fromvillages cities midst lockdown supply chains don’t workproperly lot food wasted lead massive losses indianfarmers experts warn india also brink major unemploymentcrisis economist vivek kaul says people work small businesses may endup job salary losses “i know places companies areactively discussing many people need fire” says that’snot all sector immune covid19 disruption vulnerable tourism industry see greater disruptions world travel tourism council calculated tourism generated 92 gdp supported 42673 million jobs tourism dependent states like kerala karnataka earn huge forex disease continues many operators forced go businessin exports industry gloom doom surrounding covid19 palpable crisis might also throw great opportunities india already reports several western manufacturers looking moving factories china many indian chemical producers gone record received inquiries western manufacturers earlier never used look towards india source tapping opportunities however require serious innovation policy front indian policymakers need hunker plan economic assistance help india’s export sector survive immediate crisis also retain stability resume growth medium longtermwith flights suspended midapril shutdown alsobound push india’s fastgrowing aviation industry peril centre forasia pacific aviation capa assessed indian aviation industrywill post losses worth nearly 4bn year likely cascadingeffect affecting hospitality tourism industries hotels restaurantchains across country empty likely remain severalmonths sparking worries largescale layoffs automobile industry keyindicator country’s economic growth also forced hit thebrakes – experts estimating losses nearly 2bnso india’s relief package enoughexperts say it’s drop ocean compared bailouts countries us china singapore stimulus package constituting 08 percent fy20 gdp par address urgent needs smaller businesses experts say india definitely needs larger stimulus package soon help businesses extraordinary crisisdesperate times call desperate measures india done well containing dangerous virus act swiftly decisively protect economy clearly need greater fiscalmonetary coordination ensure optimal policy responseblackcoffer insights 16 manan batradelhi college arts commerce akshat mittalshri guru gobind singh college commercedelhi,39,51,-0.13333333185185187,0.7894736772853186,10.040816326530612,2.382636248415716,4.969381029978532,10.16,18799,7649,145828,4,1.0
